{
  "$schema": "../../schemas/design-spec.v1.schema.json",
  "spec_version": "2.2.0",
  "domain_archetype": "HIGH_PERFORMANCE_SAAS",
  "visual_chemistry": "MINIMALIST_SAAS",
  "core_parameters": {
    "primary_palette": {
      "canvas_oklch": "oklch(0.14 0.005 260)",
      "surface_oklch": "oklch(0.18 0.008 260)",
      "primary_accent_oklch": "oklch(0.65 0.22 265)",
      "border_oklch": "oklch(0.28 0.01 260)"
    },
    "typography_pair": {
      "display_font": "Inter, system-ui, sans-serif",
      "body_font": "Inter, system-ui, sans-serif",
      "mono_font": "JetBrains Mono, monospace"
    },
    "surface_treatment": "subtle_mesh_glow_with_svg_noise",
    "grid_density": "bento_asymmetric",
    "hero_composition": "split_terminal"
  },
  "accessibility_contract": {
    "wcag_level": "AA",
    "min_touch_target_px": 16,
    "focus_visible_required": true
  },
  "semantic_rtl_contract": {
    "enabled": true,
    "physical_macro_stability": true,
    "bidi_isolation": true,
    "code_ltr_enforced": true
  },
  "novelty_budget": {
    "dimensions_varied": [
      "hero_composition",
      "grid_density",
      "accent_palette"
    ],
    "entropy_heuristic": 0.85
  }
}
